{
  "$schema": "https://json-schema.org/draft/2020-12/schema",
  "$id": "https://schemas.runx.ai/runx/security/exact-cve-evidence/v1.json",
  "x-runx-packet-id": "runx.security.exact_cve_evidence.v1",
  "type": "object",
  "required": ["schema", "generated_at", "summary", "observations", "target", "dependency_scope", "method", "queries", "findings"],
  "properties": {
    "schema": { "const": "runx.security.exact_cve_evidence.v1" },
    "generated_at": { "type": "string", "minLength": 1 },
    "summary": { "type": "string", "minLength": 1 },
    "observations": {
      "type": "array",
      "minItems": 1,
      "items": {
        "type": "object",
        "required": ["id", "statement", "evidence"],
        "properties": {
          "id": { "type": "string", "minLength": 1 },
          "statement": { "type": "string", "minLength": 1 },
          "evidence": { "type": "object", "additionalProperties": true }
        },
        "additionalProperties": true
      }
    },
    "target": { "type": "object", "additionalProperties": true },
    "dependency_scope": { "enum": ["direct-production", "all-installed"] },
    "method": { "type": "object", "additionalProperties": true },
    "queries": {
      "type": "array",
      "items": {
        "type": "object",
        "required": ["query", "returned_advisory_ids"],
        "properties": {
          "query": { "type": "object", "additionalProperties": true },
          "returned_advisory_ids": {
            "type": "array",
            "items": { "type": "string", "minLength": 1 }
          }
        },
        "additionalProperties": true
      }
    },
    "findings": {
      "type": "array",
      "items": { "type": "object", "additionalProperties": true }
    },
    "artifact": { "$ref": "#/$defs/artifact" },
    "audit_artifact": { "$ref": "#/$defs/artifact" }
  },
  "$defs": {
    "artifact": {
      "type": "object",
      "required": ["path", "sha256"],
      "properties": {
        "path": { "type": "string", "minLength": 1 },
        "sha256": { "type": "string", "pattern": "^[0-9a-f]{64}$" }
      },
      "additionalProperties": true
    }
  },
  "additionalProperties": true
}
