{
  "schema": "runx.security.exact_cve_evidence.v1",
  "generated_at": "2026-07-15T00:46:07.066Z",
  "summary": "Audited 16 exact direct-production dependency versions from the pinned OWASP NodeGoat lockfile and found 13 current OSV advisories with exact-version evidence.",
  "observations": [
    {
      "id": "immutable_target",
      "statement": "The audit input is pinned to an immutable repository commit and lockfile digest.",
      "evidence": {
        "commit": "c5cb68a7084e4ae7dcc60e6a98768720a81841e8",
        "lockfile_sha256": "b9ed49893a9d3bcf6fe567cd38fe8168850591e0018f19d3bb0d1f80a4c2eecc"
      }
    },
    {
      "id": "exact_dependency_inventory",
      "statement": "Every OSV query uses an exact installed dependency version from the requested scope.",
      "evidence": {
        "dependency_scope": "direct-production",
        "exact_dependencies_queried": 16
      }
    },
    {
      "id": "real_advisory_source",
      "statement": "Advisories are loaded from OSV and withdrawn advisories are excluded.",
      "evidence": {
        "source": "OSV",
        "source_url": "https://api.osv.dev"
      }
    },
    {
      "id": "traceable_findings",
      "statement": "Every finding records the dependency, exact version, advisory id, advisory URL, and exact query.",
      "evidence": {
        "advisory_findings": 13,
        "affected_dependencies": 6
      }
    }
  ],
  "target": {
    "name": "OWASP NodeGoat",
    "repo": "https://github.com/OWASP/NodeGoat",
    "commit": "c5cb68a7084e4ae7dcc60e6a98768720a81841e8",
    "lockfile_url": "https://raw.githubusercontent.com/OWASP/NodeGoat/c5cb68a7084e4ae7dcc60e6a98768720a81841e8/package-lock.json",
    "lockfile_sha256": "b9ed49893a9d3bcf6fe567cd38fe8168850591e0018f19d3bb0d1f80a4c2eecc",
    "lockfile_version": 2
  },
  "dependency_scope": "direct-production",
  "method": {
    "inventory_source": "package-lock.json packages map",
    "query_contract": "{ package: { ecosystem: npm, name }, version: exact_version }",
    "advisory_source": "https://api.osv.dev/v1",
    "withdrawn_advisories_excluded": true,
    "false_positive_control": "Each finding must be present in OSV's response for the exact package/version tuple and is replayed by an independent verification step."
  },
  "queries": [
    {
      "query": {
        "package": {
          "ecosystem": "npm",
          "name": "bcrypt-nodejs"
        },
        "version": "0.0.3"
      },
      "returned_advisory_ids": []
    },
    {
      "query": {
        "package": {
          "ecosystem": "npm",
          "name": "body-parser"
        },
        "version": "1.18.3"
      },
      "returned_advisory_ids": [
        "GHSA-qwcr-r2fm-qrc7"
      ]
    },
    {
      "query": {
        "package": {
          "ecosystem": "npm",
          "name": "consolidate"
        },
        "version": "0.14.5"
      },
      "returned_advisory_ids": []
    },
    {
      "query": {
        "package": {
          "ecosystem": "npm",
          "name": "csurf"
        },
        "version": "1.9.0"
      },
      "returned_advisory_ids": []
    },
    {
      "query": {
        "package": {
          "ecosystem": "npm",
          "name": "dont-sniff-mimetype"
        },
        "version": "1.0.0"
      },
      "returned_advisory_ids": []
    },
    {
      "query": {
        "package": {
          "ecosystem": "npm",
          "name": "express"
        },
        "version": "4.16.4"
      },
      "returned_advisory_ids": [
        "GHSA-qw6h-vgh9-j6wx",
        "GHSA-rv95-896h-c2vc"
      ]
    },
    {
      "query": {
        "package": {
          "ecosystem": "npm",
          "name": "express-session"
        },
        "version": "1.15.6"
      },
      "returned_advisory_ids": []
    },
    {
      "query": {
        "package": {
          "ecosystem": "npm",
          "name": "forever"
        },
        "version": "2.0.0"
      },
      "returned_advisory_ids": []
    },
    {
      "query": {
        "package": {
          "ecosystem": "npm",
          "name": "helmet"
        },
        "version": "2.3.0"
      },
      "returned_advisory_ids": []
    },
    {
      "query": {
        "package": {
          "ecosystem": "npm",
          "name": "marked"
        },
        "version": "0.3.5"
      },
      "returned_advisory_ids": [
        "GHSA-5v2h-r2cx-5xgj",
        "GHSA-7px7-7xjx-hxm8",
        "GHSA-p9wx-2529-fp83",
        "GHSA-rrrm-qjm4-v8hf",
        "GHSA-vfvf-mqq8-rwqc",
        "GHSA-x5pg-88wf-qq4p"
      ]
    },
    {
      "query": {
        "package": {
          "ecosystem": "npm",
          "name": "mongodb"
        },
        "version": "2.2.36"
      },
      "returned_advisory_ids": [
        "GHSA-mh5c-679w-hh4r"
      ]
    },
    {
      "query": {
        "package": {
          "ecosystem": "npm",
          "name": "needle"
        },
        "version": "2.2.4"
      },
      "returned_advisory_ids": []
    },
    {
      "query": {
        "package": {
          "ecosystem": "npm",
          "name": "node-esapi"
        },
        "version": "0.0.1"
      },
      "returned_advisory_ids": []
    },
    {
      "query": {
        "package": {
          "ecosystem": "npm",
          "name": "serve-favicon"
        },
        "version": "2.5.0"
      },
      "returned_advisory_ids": []
    },
    {
      "query": {
        "package": {
          "ecosystem": "npm",
          "name": "swig"
        },
        "version": "1.4.2"
      },
      "returned_advisory_ids": [
        "GHSA-2rq5-699j-x7p6"
      ]
    },
    {
      "query": {
        "package": {
          "ecosystem": "npm",
          "name": "underscore"
        },
        "version": "1.9.1"
      },
      "returned_advisory_ids": [
        "GHSA-cf4h-3jhx-xvhq",
        "GHSA-qpx9-hpmf-5gmw"
      ]
    }
  ],
  "findings": [
    {
      "dependency": "body-parser",
      "exact_version": "1.18.3",
      "advisory_id": "GHSA-qwcr-r2fm-qrc7",
      "advisory_url": "https://osv.dev/vulnerability/GHSA-qwcr-r2fm-qrc7",
      "exact_query": {
        "package": {
          "ecosystem": "npm",
          "name": "body-parser"
        },
        "version": "1.18.3"
      }
    },
    {
      "dependency": "express",
      "exact_version": "4.16.4",
      "advisory_id": "GHSA-qw6h-vgh9-j6wx",
      "advisory_url": "https://osv.dev/vulnerability/GHSA-qw6h-vgh9-j6wx",
      "exact_query": {
        "package": {
          "ecosystem": "npm",
          "name": "express"
        },
        "version": "4.16.4"
      }
    },
    {
      "dependency": "express",
      "exact_version": "4.16.4",
      "advisory_id": "GHSA-rv95-896h-c2vc",
      "advisory_url": "https://osv.dev/vulnerability/GHSA-rv95-896h-c2vc",
      "exact_query": {
        "package": {
          "ecosystem": "npm",
          "name": "express"
        },
        "version": "4.16.4"
      }
    },
    {
      "dependency": "marked",
      "exact_version": "0.3.5",
      "advisory_id": "GHSA-5v2h-r2cx-5xgj",
      "advisory_url": "https://osv.dev/vulnerability/GHSA-5v2h-r2cx-5xgj",
      "exact_query": {
        "package": {
          "ecosystem": "npm",
          "name": "marked"
        },
        "version": "0.3.5"
      }
    },
    {
      "dependency": "marked",
      "exact_version": "0.3.5",
      "advisory_id": "GHSA-7px7-7xjx-hxm8",
      "advisory_url": "https://osv.dev/vulnerability/GHSA-7px7-7xjx-hxm8",
      "exact_query": {
        "package": {
          "ecosystem": "npm",
          "name": "marked"
        },
        "version": "0.3.5"
      }
    },
    {
      "dependency": "marked",
      "exact_version": "0.3.5",
      "advisory_id": "GHSA-p9wx-2529-fp83",
      "advisory_url": "https://osv.dev/vulnerability/GHSA-p9wx-2529-fp83",
      "exact_query": {
        "package": {
          "ecosystem": "npm",
          "name": "marked"
        },
        "version": "0.3.5"
      }
    },
    {
      "dependency": "marked",
      "exact_version": "0.3.5",
      "advisory_id": "GHSA-rrrm-qjm4-v8hf",
      "advisory_url": "https://osv.dev/vulnerability/GHSA-rrrm-qjm4-v8hf",
      "exact_query": {
        "package": {
          "ecosystem": "npm",
          "name": "marked"
        },
        "version": "0.3.5"
      }
    },
    {
      "dependency": "marked",
      "exact_version": "0.3.5",
      "advisory_id": "GHSA-vfvf-mqq8-rwqc",
      "advisory_url": "https://osv.dev/vulnerability/GHSA-vfvf-mqq8-rwqc",
      "exact_query": {
        "package": {
          "ecosystem": "npm",
          "name": "marked"
        },
        "version": "0.3.5"
      }
    },
    {
      "dependency": "marked",
      "exact_version": "0.3.5",
      "advisory_id": "GHSA-x5pg-88wf-qq4p",
      "advisory_url": "https://osv.dev/vulnerability/GHSA-x5pg-88wf-qq4p",
      "exact_query": {
        "package": {
          "ecosystem": "npm",
          "name": "marked"
        },
        "version": "0.3.5"
      }
    },
    {
      "dependency": "mongodb",
      "exact_version": "2.2.36",
      "advisory_id": "GHSA-mh5c-679w-hh4r",
      "advisory_url": "https://osv.dev/vulnerability/GHSA-mh5c-679w-hh4r",
      "exact_query": {
        "package": {
          "ecosystem": "npm",
          "name": "mongodb"
        },
        "version": "2.2.36"
      }
    },
    {
      "dependency": "swig",
      "exact_version": "1.4.2",
      "advisory_id": "GHSA-2rq5-699j-x7p6",
      "advisory_url": "https://osv.dev/vulnerability/GHSA-2rq5-699j-x7p6",
      "exact_query": {
        "package": {
          "ecosystem": "npm",
          "name": "swig"
        },
        "version": "1.4.2"
      }
    },
    {
      "dependency": "underscore",
      "exact_version": "1.9.1",
      "advisory_id": "GHSA-cf4h-3jhx-xvhq",
      "advisory_url": "https://osv.dev/vulnerability/GHSA-cf4h-3jhx-xvhq",
      "exact_query": {
        "package": {
          "ecosystem": "npm",
          "name": "underscore"
        },
        "version": "1.9.1"
      }
    },
    {
      "dependency": "underscore",